5,2,9		"CUTSCENE
vocs_over_over_	_n00	vocs_over_over_monastery1_debriefing_n00	omuk	hambo		ALCHEMIST	satisfied		おお、もうこの場所とは永遠におさらばじゃ。																						
vocs_over_over_	_n01	vocs_over_over_monastery1_debriefing_n01	omuk	hambo		GEISHA	curious		お聞きしてもよろしいでしょうか？自由の身となった今、どちらに向かわれるのですか？																						
vocs_over_over_	_n02	vocs_over_over_monastery1_debriefing_n02	omuk	hambo		ALCHEMIST	determined		ふぅむ。藪大名の野望に肩入れするつもりなんぞこれっぽっちも無かった。一方でお主たちの手助けなら喜んでしようぞ。																						
vocs_over_over_	_n03	vocs_over_over_monastery1_debriefing_n03	omuk	hambo		WARRIOR	satisfied		ご無理をさせるつもりはありませぬ。																						
vocs_over_over_	_n04	vocs_over_over_monastery1_debriefing_n04	omuk	hambo		ALCHEMIST	determined		へっへ、武源。心配せずとも適切な道具さえあれば、ワシのような老いぼれでも戦場で十分役に立てるわい。																						
vocs_over_over_	_n05	vocs_over_over_monastery1_debriefing_n05	omuk	hambo		GEISHA	impressed		巧磨様は多才なお方ですのね。																						
vocs_over_over_	_n06	vocs_over_over_monastery1_debriefing_n06	omuk	hambo		ALCHEMIST	mysterious		多才すぎて厄介ごとばかり抱え込んでしまうほどじゃ。へっへっへ。																						
vocs_over_over_	_n07	vocs_over_over_monastery1_debriefing_n07	omuk	hambo		WARRIOR	satisfied		それではひとまず陣営に戻り、藪大名討伐について作戦を練りましょうぞ。																						
