lvl,sec,voen,vojp,s,en,cn,jp
21,26,vocs_over_over_bathhouse_post_n00,vocs_bathhouse_post_n00_jp,BROGUNSON,"Teh, I don't know ... my father … doesn't share … his plans ... with me …",我不知道……父亲大人没有……把他的计划……告诉我……,知らない…父上は…計画を…私に話そうとはしない…。
21,26,vocs_over_over_bathhouse_post_n01,vocs_bathhouse_post_n01_jp,ALCHEMIST,That is all I can do. If we give him a higher dose he won't wake up again.,只能用这么大剂量。如果药量再加大，他就永远醒不过来了。,これが限界じゃ。もしこれ以上薬を増やせば、二度と起きんくなるわい。
21,26,vocs_over_over_bathhouse_post_n02,vocs_bathhouse_post_n02_jp,GEISHA,Then we must work with what we have.,既然问不出来，那就只能另谋他路了。,なら、別の方法で続けるしかないわね。
21,26,vocs_over_over_bathhouse_post_n03,vocs_bathhouse_post_n03_jp,TRAPPER,Let me hurt him.,让我也出口气。,痛めつけましょう。
21,26,vocs_over_over_bathhouse_post_n04,vocs_bathhouse_post_n04_jp,GEISHA,He's the only chance we have to resolve this matter.,他是我们洗清罪名的唯一机会。,彼はこの件の解決のためのたった一つの可能性。
21,26,vocs_over_over_bathhouse_post_n05,vocs_bathhouse_post_n05_jp,ALCHEMIST,"Hmm, you have a plan?",唔…看来你已经想出方法了？,ふーむ、何かあるのじゃな？
21,26,vocs_over_over_bathhouse_post_n06,vocs_bathhouse_post_n06_jp,GEISHA,"The Shogun would never believe us if we tried to explain ourselves. But if Masaru confessed to him that he is Ryūnosuke's murderer, it might turn things in our favour.",将军不会相信我们说的话，但是假如让真申亲口承认他是杀死龙之介的真凶，或许就能扭转乾坤。,上様は私たちを信用しようとしないでしょうね。けど、自分が龍之介様を殺したと勝が自白すれば、こちらの思うようにいくかもしれないわ。
21,26,vocs_over_over_bathhouse_post_n07,vocs_bathhouse_post_n07_jp,TRAPPER,So we … give him to the Shogun? Like a package?,所以我们……要像送礼一样，把他亲手交给将军吗？,ってことは、将軍にこの人を渡すの？土産みたいに？
21,26,vocs_over_over_bathhouse_post_n08,vocs_bathhouse_post_n08_jp,NINJA,It won't be easy with that bounty on our heads.,没这么简单吧，我们可都是被通缉的要犯。,そんな簡単に結果は得られないだろう。
21,26,vocs_over_over_bathhouse_post_n09,vocs_bathhouse_post_n09_jp,ALCHEMIST,There's more. Yuki and I overheard some news when we were out. The Shogun left Edo not long ago.,对了，之前友希和我外出时，听说将军不久前刚离开江户。,そうじゃ、雪ちゃんとワシは外にいた時に聞いてたんじゃよ。上様は最近江戸を出られたらしい。
21,26,vocs_over_over_bathhouse_post_n10,vocs_bathhouse_post_n10_jp,TRAPPER,He's on his way to visit the emperor in Kyoto.,他要去京都拜见天皇。,京都の天皇の所へ参られる途中だよ。
21,26,vocs_over_over_bathhouse_post_n11,vocs_bathhouse_post_n11_jp,NINJA,So he's not in his residence in Edo Castle. Could work for us.,也就是说，将军目前不在江户城中。或许是个好机会。,つまり、上様は江戸城には不在か。うまくいくかもしれん。
21,26,vocs_over_over_bathhouse_post_n12,vocs_bathhouse_post_n12_jp,GEISHA,How big is his entourage?,他带了多少人？,側近はどれほどいるかしら？
21,26,vocs_over_over_bathhouse_post_n13,vocs_bathhouse_post_n13_jp,ALCHEMIST,"Three hundred thousand men. A display of power, just for the emperor.",三十万人。显然是为了向天皇展示实力。,30万じゃ。力の証じゃよ。陛下へのな。
21,26,vocs_over_over_bathhouse_post_n14,vocs_bathhouse_post_n14_jp,NINJA,That could be a problem.,这就不好办了。,それは問題だな。
21,26,vocs_over_over_bathhouse_post_n15,vocs_bathhouse_post_n15_jp,ALCHEMIST,A wise man knows when to bow his head and accept defeat.,人贵有自知之明，该收手的时候就收手吧。,賢者は知る、負けを認めて頭を下げる時をな。
21,26,vocs_over_over_bathhouse_post_n16,vocs_bathhouse_post_n16_jp,GEISHA,… no. ,……不。 ,…違う。 
21,26,vocs_over_over_bathhouse_post_n17,vocs_bathhouse_post_n17_jp,GEISHA,"Mugen dedicated his life to the Shogun. For Mugen, we must reveal the truth and leave our fate in the Shogun's hands.",无限把一生都奉献给了将军。就算是为了无限，我们也必须揭露真相，让将军决断。,武源様は上様のために命をかけたわ。上様のため、真実を暴いて、上様の手に委ねましょう。
21,26,vocs_over_over_bathhouse_post_n18,vocs_bathhouse_post_n18_jp,NINJA,"… alone against three hundred thousand. Teh, I know Mugen would have liked that.",……对抗三十万大军吗。无限如果还在，肯定会很兴奋的吧。,…30万に対抗かぁ。武源だったら、喜びそうな話だ。
21,26,vocs_over_over_bathhouse_post_n19,vocs_bathhouse_post_n19_jp,ALCHEMIST,"Forgive me, Aiko-san. I can not let you drag Yuki-chan into this.",爱子小姐。你们一定要去我也能理解，但这次可不要再把友希姑娘牵扯进来了。,愛琥さん、いいじゃろうか。この件に雪ちゃんを巻き込みたくはない。
21,26,vocs_over_over_bathhouse_post_n20,vocs_bathhouse_post_n20_jp,TRAPPER,… I trust Aiko-san.,……我相信爱子姐。,…あたしは愛琥さんを信じます。
21,26,vocs_over_over_bathhouse_post_n21,vocs_bathhouse_post_n21_jp,ALCHEMIST,Yuki-chan!,友希姑娘!,雪ちゃん！
21,26,vocs_over_over_bathhouse_post_n22,vocs_bathhouse_post_n22_jp,TRAPPER,Takuma-sensei ... I want to go with her.,琢磨师父……我想和爱子姐一起去 。,巧磨先生…あたし、愛琥さんと行きたいです。
21,26,vocs_over_over_bathhouse_post_n23,vocs_bathhouse_post_n23_jp,ALCHEMIST,Child …,你这孩子……,子どもじゃの…。
21,26,vocs_over_over_bathhouse_post_n24,vocs_bathhouse_post_n24_jp,TRAPPER,Please. I don't want to choose. Don't make me choose.,求您了。我不想左右为难，不要逼我选边站。,お願い。選びたくないの。あたしに選ばせないで。
21,26,vocs_over_over_bathhouse_post_n25,vocs_bathhouse_post_n25_jp,ALCHEMIST,"Hmm ... very well, Yuki-chan. Once more I shall follow you into the jaws of death.",嗯…那好吧，友希姑娘。老夫就再陪你闯一次鬼门关。,うーむ…そうかい、雪ちゃん。もう一度、死地へと共にしよう。
21,26,vocs_over_over_bathhouse_post_n26,vocs_bathhouse_post_n26_jp,TRAPPER,Hai!,好！,はい！
21,26,vocs_over_over_bathhouse_post_n27,vocs_bathhouse_post_n27_jp,GEISHA,You all have my thanks. Do we know where the Shogun is now?,感谢大家。谁知道将军的具体位置？,感謝します。上様が今どこにいるかわかるかしら？
21,26,vocs_over_over_bathhouse_post_n28,vocs_bathhouse_post_n28_jp,NINJA,I'd say he's taking the Nakasendō route. We could catch up with him on the Myōgi mountain pass.,他走的应该是中山道，我们可以在妙义岭追上他。,おそらく中山道にいるはずだ。妙義峠で追いつこう。
21,26,vocs_over_over_bathhouse_post_n29,vocs_bathhouse_post_n29_jp,GEISHA,It will be cold there this time of year. Let us prepare for the worst.,现在这个时节那边肯定很冷。大家做好万全准备。,その辺り、今年は寒くなりそうね。備えて向かいましょう。
